,news_text
1162,นายอัลเบิร์ต บัวร์ลา ประธานเจ้าหน้าที่บริหารบริษัทไฟเซอร์ อิงค์ เปิดเผยว่า ทางบริษัทเริ่มพัฒนาวัคซีนสูตรใหม่เพื่อรับมือกับเชื้อโควิด-19 กลายพันธุ์สายพันธุ์โอไมครอนโดยเฉพาะแล้ว เนื่องจากวัคซีนที่ใช้อยู่ในปัจจุบันอาจมีประสิทธิภาพน้อยในการต้านทานเชื้อกลายพันธุ์ใหม่นี้  โดยก่อนหน้านี้ไฟเซอร์และบริษัทไบโอเอ็นเทคของเยอรมนีก็สามารถพัฒนาวัคซีนสูตรเฉพาะสำหรับรับมือกับเชื้อสายพันธุ์เบตาและเดลตาได้ใน 95 วัน แต่ไม่มีโอกาสได้ใช้ เนื่องจากวัคซีนสูตรเดิมยังต้านเชื้อกลายพันธุ์เหล่านี้ได้
1163,"สถานการณ์แพร่ระบาดไวรัสโควิด-19 จ.ระยอง ประจำวันที่ 30 พฤศจิกายน 2564 พบผู้ติดเชื้อรายใหม่เพิ่ม 76 ราย หายป่วยกลับบ้าน 136 ราย  ยังเหลือผู้ป่วยอยู่ระหว่างรักษา 1,267 ราย"
1164,บรรยากาศ การให้บริการฉีดวัคซีนที่ด่านตรวจท่าสาป วันนี้ (30 พ.ย 64) ซึ่งเป็นวันสุดท้ายที่ ทาง รพ.ยะลา จะตั้งจุดบริการฉีดวัคซีนไฟเซอร์เข็มแรกให้กับประชาชนที่ยังไม่ได้รับวัคซีน และต้องการเข้าพื้นที่ จ.ยะลา ก็จะต้องได้รับการฉีดวัคซีนก่อนเข้าเมือง ตั้งแต่ช่วงเช้า หลังเปิดให้บริการ ได้มีประชาชนทยอยเข้ารับการฉีดวัคซีน กันอย่างต่อเนื่อง
1165,"นายแพทย์ประเสริฐ กิจสุวรรณรัตน์ นายแพทย์สาธารณสุขจังหวัดลำปาง เปิดเผยว่า จังหวัดลำปางเชิญชวนชาวลำปางอีกประมาณ 70,000 คน ที่ยังไม่ได้รับการฉีดวัคซีนป้องกันโควิด-19 ให้รับการฉีดวัคซีน ซึ่งขณะนี้ได้ปรับสูตรการฉีดวัคซีน คือ เข็มแรกเป็นวัคซีน AstraZeneca และถัดไปประมาณ 1 เดือน จะให้เข็ม 2 เป็นวัคซีน Pfizer"
1166,วันที่ 30 พฤศจิกายน 2564 เวลา 10.00 น. นายชลธี ยังตรง ผู้ว่าราชการจังหวัดยโสธร เป็นประธานในพิธีเปิดการ Kick off รณรงค์ ยโสธรเปิดเมืองปลอดภัย ร่วมใจฉีดวัคซีน โควิด-19 โดยมี นายสุวัฒน์ เข็มเพชร นายชัยวัฒน์ แสงศรี รองผู้ว่าราชการจังหวัดยโสธร นายชัยวัฒน์ ชัยเวชพิสิฐ ปลัดจังหวัดยโสธร พร้อมหัวหน้าส่วนราชการ ภาคเอกชน ผู้นำชุมชน และเยาวชนในจังหวัดยโสธร ร่วมงาน  และมีนายแพทย์ธีระพงษ์ แก้วภมร นายแพทย์สาธารณสุขจังหวัดยโสธร ณ ห้องประชุม 1 ชั้น 4 สำนักงานสาธารณสุขจังหวัดยโสธร
1167,"กรมควบคุมโรค กำหนดให้วันที่ 27 พฤศจิกายน- วันที่ 5 ธันวาคม 2564 เป็น ""สัปดาห์แห่งการฉีดวัคซีน"" สู่เป้าหมาย 100 ล้านโดส เพื่อป้องกันการติดเชื้อไวรัสโคโรนา 2019 และเพื่อความปลอดภัยของประชาชน"
1168,โรงพยาบาลสบเมย จังหวัดแม่ฮ่องสอน เปิดให้บริการฉีดวัคซีนป้องกันโควิดสูตรใหม่แก่ประชาชน เข็มที่ 1 แอสตราเซเนกา (AstraZeneca) เข็มที่ 2 ไฟเซอร์ (Pfizer) (หรือ AstraZeneca ในกรณีจำเป็น) ณ สำนักงานสาธารณสุขอำเภอสบเมย อำเภอสบเมย จังหวัดแม่ฮ่องสอน (ตรงข้าม ธกส.สบเมย) ทุกวันศุกร์ในเดือนธันวาคม 2564 เวลา 08.00 น. เป็นต้นไป สำหรับผู้เข้ารับวัคซีนสูตรดังกล่าวต้องเป็นประชาชนที่ยังไม่เคยได้รับวัคซีน ที่มีอายุตั้งแต่ 18 ปี ขึ้นไป โดยผู้ที่สนใจเข้ารับวัคซีนให้เตรียมบัตรประชาชนตัวจริงไปในวันเข้ารับบริการด้วย สอบถามข้อมูลเพิ่มเติมได้ที่ โรงพยาบาลสบเมย โทรศัพท์ 053-618-080
1169,เหล่ากาชาดมุกดาหาร ให้กำลังใจผู้เข้ารับวัคซีนไฟเซอร์-โมเดอร์นา เนื่องใน “สัปดาห์แห่งการฉีดวัคซีน” สู่เป้าหมาย 100 ล้านโดส
1170,"(30 พ.ย.64) ที่ห้องราชภักดิ์ ชั้น 5 สำนักงานสาธารณสุขจังหวัดประจวบคีรีขันธ์  นายพรหมพิริยะ กิจนุสนธิ์ รองผู้ว่าราชการจังหวัดประจวบคีรีขันธ์ เป็นประธานการประชุมคณะกรรมการโรคติดต่อจังหวัดฯ ผ่านระบบซูม โดยมีการรายงานสถานการณ์การแพร่ระบาดของโรคโควิด -19 ของ จ.ประจวบฯ ประจำวันที่ 30 พ.ย.64 พบผู้ป่วยติดเชื้อรายใหม่ 60 คน ไม่มีผู้เสียชีวิตเพิ่ม ยอดสะสมผู้เสียชีวิต 114 คน มีประชาชนได้รับวัคซีนโควิด เข็ม 1 แล้ว 391,983 คน คิดเป็นร้อยละ 67.8 ของประชากรในจังหวัด ได้รับวัคซีนครบ 2 เข็ม 348,409 คน คิดเป็นร้อยละ 60.3 ของประชากรในจังหวัด และมีผู้ได้รับวัคซีนกระตุ้นภูมิคุ้มกัน เข็ม 3 จำนวน 20,409 คน คิดเป็นร้อยละ 3.5 ของประชากรในจังหวัด"
1171,สำนักงานประชาสัมพันธ์จังหวัดแพร่ รายงานว่า วันนี้ (30 พ.ย. 64) เวลา 14.30 น. ณ ห้องประชุมจดหมายเหตุ ศาลากลางจังหวัดแพร่ นายสมหวัง พ่วงบางโพ ผู้ว่าราชการจังหวัดแพร่ เป็นประธานการประชุมคณะกรรมการโรคติดต่อจังหวัดแพร่ ครั้งที่ 36 ประจำปี 2564 เพื่อรับทราบสถานการณ์การระบาดของโรคโควิด-19 ผลการให้บริการวัคซีนของจังหวัดแพร่และทบทวนมาตรการป้องกันและควบคุมการแพร่ระบาด
1172,"วันนี้ (30 พ.ย.2564) เวลา 09.00 น. นางอิสรีย์ มั่งคั่ง นายกเหล่ากาชาดจังหวัดมุกดาหาร พร้อมด้วยสมาชิกเหล่ากาชาดฯ เข้าพบปะให้กำลังใจบุคลากรทางการแพทย์ และประชาชนที่เข้ารับการฉีดวัคซีนไฟเซอร์ และโมเดอร์นา เข็มแรก ที่หอประชุม 250 ปี จังหวัดมุกดาหาร โดยแยกเป็นวัคซีน โมเดอร์นา สำหรับผู้สูงอายุ คนพิการและผู้ด้อยโอกาสที่ได้มีการจองคิวไว้แล้วรวมทั้งสิ้น 530 โดส และยี่ห้อไฟเซอร์ จำนวน 500 โดส/วัน สำหรับประชาชนทั่วไป ซึ่งสามารถ ""วอล์คอิน"" (Walk-in) เข้าไปรับการฉีดวัคซีนได้เลย ตั้งแต่วันนี้ถึงวันที่ 5 ธันวาคม 2564 ซึ่งเป็นสัปดาห์แห่งการฉีดวัคซีน ของกรมควบคุมโรคกำหนดให้ระหว่างวันที่ 27 พ.ย. -5 ธ.ค.64"
1173,"ยะลา เปิดจองวัคซีนโมเดอร์นา สำหรับประชาชน 3 กลุ่ม วันนี้(1 ธ.ค 64) ทางโรงพยาบาลยะลา ได้เปิดให้ประชาชน จองวัคซีนทางเลือก โมเดอร์นา ซึ่งได้รับการจัดสรรมา จำนวน  16,000 โดส ในสัปดาห์แห่งการฉีดวัคซีนโควิด-19 สู่เป้าหมายประเทศ 100 ล้านโดส ให้กับประชาชน 3 กลุ่ม โดยกลุ่มที่ 1 ผู้ที่ฉีด ซิโนแวค+ซิโนแวค และ ชิโนฟาร์ม+ซิโนฟาร์ม ครบ 2 เข็ม  ครบ 1 เดือน ( ฉีดก่อน 4 พ.ย. 64 )  ให้มาฉีดกระตุ้น เข็มที่ 3  กลุ่มที่ 2 ผู้ที่ฉีด ซิโนแวค/แอสตร้า/ชิโนฟาร์ม/ไฟเซอร์ เข็มที่ 1 ครบ 1 เดือน ( ฉีดก่อน 4 พ.ย. 64 ) ให้มาฉีด เข็มที่ 2  และกลุ่มที่ 3 ฉีดกระตุ้น สำหรับผู้ติดเชื้อโควิด-19 ครบ 1 เดือน ไม่เคยได้รับวัคซีนใด ฯ มาก่อน  ได้รับวัคซีน 1 เข็ม ก่อนติดเชื้อ ติดเชื้อ ภายใน 2 สัปดาห์ หลังจากฉีดเข็ม 2 ให้มาฉีดกระตุ้น ด้วยโมเดอร์นา"
1174,นายแพทย์พัลลภ ยอดศิรจินดา นายแพทย์สาธารณสุขจังหวัดชัยนาท เปิดเผยว่า ตามที่ สำนักงานสาธารณสุขจังหวัดชัยนาท ได้กำหนดให้ในระหว่างวันที่ 8-30 พฤศจิกายน 2564 เป็นเดือนแห่งการรณรงค์ฉีดวัคซีนโควิด-19 ให้ประชาชน มีอายุตั้งแต่ 18 ปีขึ้นไปและยังไม่ได้รับการฉีดวัคซีนโควิด-19 มาก่อน โดยได้มอบหมายให้ทุกโรงพยาบาลส่งเสริมสุขภาพตำบลทุกแห่งเร่งสำรวจประชาชนที่ยังไม่ได้รับวัคซีนในแต่ละหมู่บ้านและเชิญชวนให้มารับวัคซีน ซิโนแวคเข็มแรกได้ที่โรงพยาบาลส่งเสริมสุขภาพตำบลทุกแห่งใกล้บ้าน ได้ทุกวันเว้นวันหยุดราชการและนักขัตฤกษ์ ขณะนี้ได้ขยายเวลาไปจนถึง วันที่ 31 ธันวาคม 2564 และขอแจ้งให้ผู้ที่ได้รับวัคซีน ทั้งซิโนแวคและซิโนฟาร์มแล้ว 2 เข็ม รับการกระตุ้นไฟเซอร์เข็มที่ 3 ลงทะเบียนตั้งแต่บัดนี้ถึงวันที่ 10 ธันวาคม 2564 เพื่อร่วมกันสร้างภูมิคุ้มกันหมู่ ลดความรุนแรงและการเสียชีวิตจากการติดเชื้อโควิด-19 รองรับการเปิดประเทศของรัฐบาล รวมทั้งเพื่อการขับเคลื่อนเศรษฐกิจของจังหวัดชัยนาท ยืนยันว่าการฉีดวัคซีนมีผลดีกว่าการไม่ฉีดแน่นอน และวัคซีนไม่ว่าจะยี่ห้อใดก็ตามหากได้รับจนครบก็จะสามารถสร้างความปลอดภัย สร้างภูมิป้องกันโรคโควิด-19
1175,"""รพ.ยะลา"" เปิดจองคิวฉีดวัคซีน ""โมเดอร์น่า"" สำหรับ 3 กลุ่ม เช็กเงื่อนไขที่นี่ วันนี้ 1 ธันวาคม 2564 ประกาศจาก ""โรงพยาบาลยะลา"" เปิดบริการจองคิวฉีด ""วัคซีนโควิด"" ""โมเดอร์นา"" (Moderna) สำหรับ 3 กลุ่มต่อไปนี้"
1176,"(1 ธ.ค.64) นายเสถียร เจริญเหรียญ ผู้ว่าราชการจังหวัดประจวบคีรีขันธ์ เป็นประธานพิธีเปิดจุดบริการฉีดวัคซีนโควิด -19 เชิงรุก ที่โรงยิมเนเซี่ยม 2 สนามกีฬากลางจังหวัดประจวบคีรีขันธ์ โดยมี นายแพทย์วรา เศลวัตนะกุล นายแพทย์สาธารณสุขจังหวัดฯ นายแพทย์ศุภฤทธิ์ เฮงคราวิทย์ ผู้อำนวยการโรงพยาบาลประจวบคีรีขันธ์ นายสินาทร โอ่เอี่ยม ปลัดจังหวัดฯ นายสราวุธ ลิ้มอรุณรักษ์ นายกองค์การบริหารส่วนจังหวัดฯ และหัวหน้าส่วนราชการ ร่วมพิธี มีบุคลากรทางการแพทย์โรงพยาบาลประจวบคีรีขันธ์ มาให้บริการฉีดวัคซีนแอสตร้าเซนเนก้า เข็ม 1 สำหรับผู้ที่ลงทะเบียนทางระบบหมอประจวบพร้อม Version 2 ลำดับคิวที่ 1,201-1,700 และผู้ที่มีอายุ 18 ปีขึ้นไป ที่ยังไม่เคยได้รับวัคซีนโควิด - 19 การให้บริการวัคซีนแอสตร้าเซนเนก้า เข็ม 2 สำหรับผู้ที่ไม่ได้มาตามนัดเดิม (มีใบนัด) จำนวน 100 ราย และการให้บริการวัคซีนแอสตร้าเซนเนก้า เข็ม 3 สำหรับผู้ที่ฉีดวัคซีนซิโนแวค 2 เข็ม (ที่มีรายชื่อตามประกาศของ สสจ.ประจวบคีรีขันธ์) จำนวน 100 ราย"
1177,วันที่ 1 ธ.ค. 2564 เวลา 08.30 น. นายชลธี ยังตรง ผู้ว่าราชการจังหวัดยโสธร ตรวจเยี่ยมให้กำลังใจประชาชนที่มารับการฉีดวัคซีนโควิด-19 รวมทั้งให้กำลังใจบุคลากรทางการแพทย์ อสม. และเจ้าหน้าที่ที่เกี่ยวข้อง  ณ อาคารโอทอป สวนสาธารณะพญาแถน อ.เมืองยโสธร จ.ยโสธร   โดยมี ผู้อำนวยการโรงพยาบาลยโสธร และบุคลากร ให้การต้อนรับ
1178,"นายแพทย์ประดิษฐ์ ปฐวีศรีสุธา รองนายแพทย์สาธารณสุขจังหวัดระยอง แถลงสถานการณ์โควิด-19 ประจำวันนี้ ว่า สถานการณ์ผู้ติดเชื้อรายใหม่ลดลงอย่างต่อเนื่อง ล่าสุดวันนี้ พบผู้ติดเชื้อรายใหม่ 43 ราย ต่ำสุดในภาคตะวันออก และมีผู้เสียชีวิต 1 ราย  เป็นผู้สูงอายุและมีโรคประจำตัวเป็นความดันโลหิตสูงและโรคตับแข็ง ซึ่งขณะนี้ กลุ่มผู้สูงอายุ ฉีดวัคซีนไปแล้วประมาณ ร้อยละ 67.4 ส่วนภาพรวมการฉีดวัคซีนของจังหวัดระยอง มีผู้ฉีดวัคซีนแล้ว 1,354,355 เข็ม ประกอบด้วย เข็มแรก 706,042 ราย คิดเป็นร้อยละ 73.02 ของจำนวนประชากร เข็มสอง 618,133 ราย หรือร้อยละ 63.93 และเข็มสาม 29,802 ราย โดยระหว่างวันที่ 1 – 5 ธันวาคมนี้ จังหวัดระยองได้จัดสัปดาห์รณรงค์การฉีดวัคซีนขึ้น เพื่อให้ประชาชนที่ยังไม่ได้รับวัคซีนเข็มแรก ได้รับวัคซีนตามเป้า 100 ล้านโดส ตามที่รัฐบาลกำหนด สามารถเข้ารับการฉีดวัคซีนได้ที่โรงพยาบาลของรัฐทั้ง 8 แห่ง"
1179,"นายแพทย์วชิระ บถพิบูลย์ นายแพทย์สาธารณสุขจังหวัดชัยภูมิ เปิดเผยว่า วันนี้ (1 ธ.ค.64) จ.ชัยภูมิ พบผู้ติดเชื้อยืนยันรายใหม่ในจังหวัด 6 ราย และรับกลับมาจากต่างจังหวัดอีก 1 ราย  ได้แก่ อ.จัตุรัส 3 ราย, อ.เมือง 2 ราย, อ.คอนสวรรค์ 1 ราย และ อ.เนินสง่า 1 ราย    สรุปยอดรวมผู้ป่วยสะสมของจังหวัดชัยภูมิอยู่ที่ 12,288 ราย กำลังรักษาตัว 231 ราย และเสียชีวิตรวม  129 ราย"
1180,จังหวัดสตูล ประชุม ศบค.จังหวัด เน้นติดตามและป้องกันการแพร่ระบาดของเชื้อโรค COVID-19 สายพันธุ์ใหม่ ในพื้นที่ทั้งทางบกและทางเรือ ย้ำวัคซีนยังเป็นสิ่งสำคัญที่สุดในการลดความรุนแรงของผู้ติดเชื้อ
1181,วันที่ 1 ธ.ค. 64 เวลา 09.30 น. นายชลธี ยังตรง ผู้ว่าราชการจังหวัดยโสธร เป็นประธานการประชุมคณะกรรมการโรคติดต่อจังหวัดยโสธร ครั้งที่ 51/2564 โดยมีคณะกรรมการโรคติดต่อจังหวัดยโสธร หัวหน้าส่วนราชการที่เกี่ยวข้อง เข้าร่วมประชุม ณ ห้องประชุม 1 ชั้น 4 สำนักงานสาธารณสุขจังหวัดยโสธร ทั้งนี้เพื่อรับทราบสถานการณ์การแพร่ระบาดของโรคติดเชื้อไวรัสโคโรนา 2019 (COVID-19) ผลการฉีดวัคซีน การรับทราบมาตรการปลอดภัยสำหรับการเยี่ยมผู้ต้องขังภายในเรือนจำจังหวัด การพิจารณาการขออนุญาตจัดงานชิม ช้อป ใช้ ของดีอำเภอเลิงนกทา การพิจารณา (ร่าง) ประกาศจังหวัด เรื่อง มาตรการเร่งด่วนในการป้องกันและควบคุมการแพร่ระบาดโรคฯ เพิ่มเติม และการหารือแนวทางในการรณรงค์ฉีดวัคซีนให้ได้ตามกลุ่มเป้าหมาย
