,news_text
753,"วันนี้ (12 ต.ค.64) บรรยากาศการฉีดวัคซีนไฟเซอร์ให้กับเด็กนักเรียนที่มีอายุ 12-18 ปี เพื่อสร้างภูมิคุ้มกันหมู่ เตรียมพร้อมเปิดภาคเรียน ที่โรงเรียนเฉลิมพระเกียรติสมเด็จพระศรีนครินทร์ ยะลา ต.บุดี อ.เมือง จ.ยะลา นักเรียนโรงเรียนเฉลิมพระเกียรติสมเด็จพระศรีนครินทร์ ยะลา โรงเรียนอุดมศาสน์วิทยา และวิทยาลัยเทคนิคยะลา ประมาณ 1,300 คน ได้เดินทางเข้ารับการฉีดวัคซีน อย่างพร้อมเพรียงกัน โดยนายธราวุธ ช่วยเกิด นายอำเภอเมืองยะลา พร้อมด้วย นางสาววรรณารัตน์ วรรณโพธิ์ ปลัดอำเภอเมืองยะลา ผู้ดูแลรับผิดชอบตำบลบุดี นายบุญลือ นวลจันทร์ สสอ.เมืองยะลา เจ้าหน้าที่โรงพยาบาลยะลา เจ้าหน้าที่สาธารณสุขจังหวัดยะลา รพ.สต. อสม. และเจ้าหน้าที่เทศบาลตำบลบุดี กำนัน ผู้ใหญ่บ้าน ร่วมบูรณาการ"
754,"บรรยากาศการฉีดวัคซีนป้องกันเชื้อโควิด-19 ให้แก่นักเรียนในพื้นที่จังหวัดลำพูน ในวันที่สองเป็นการฉีดให้นักเรียนโรงเรียนส่วนบุญโญปถัมภ์ลำพูน ตั้งแต่ เวลา 08.30-16.00 น. ซึ่งมีนักเรียนชั้นระดับมัธยมศึกษาตอนปลาย ทยอยเดินทางมาฉีดวัคซีนแล้วกว่า 1,400 คน"
755,วันนี้ (12 ต.ค.64) นายแพทย์สาธารณสุขจังหวัดเพชรบุรี และคณะ ได้ลงพื้นที่โรงเรียนเบญจมเทพอุทิศ จังหวัดเพชรบุรี เยี่ยมชมบรรยากาศการฉีดวัคซีนไฟเซอร์ให้กับนักเรียนที่แสดงความประสงค์ฉีดวัคซีน
756,วันนี้ (12 ต.ค.64) นายปิยพล อุเซ็งแม สาธารณสุขอำเภอรามัน จังหวัดยะลา พร้อมด้วย เจ้าหน้าที่จาก รพ.สต.และ รพ.รามัน จำนวน 20 คน ลงพื้นที่โรงเรียนศรีฟารีดาบารูวิทยา ตำบลโกตาบารู อำเภอรามัน จังหวัดยะลา (โรงเรียนเอกชนสอนศาสนาอิสลาม) เพื่อฉีดวัคซีนไฟเซอร์เข็มแรก จำนวน 600 โดส ให้แก่นักเรียนชาย-หญิง อายุ 12-18 ปี ซึ่งเป็นกลุ่มเป้าหมายให้วัคซีน เพื่อป้องกันการแพร่ระบาดของโรคติดเชื้อไวรัสโคโรน่า 2019 (โควิด-19) โดยในวันนี้มีนักเรียนทยอยออกมาเข้าฉีดวัคซีนแล้ว จำนวน 372 ราย คาดว่าจะสามารถฉีดวัคซีนไฟเซอร์ให้ได้ครบ 600 โคสให้เร็วที่สุด สำหรับการเข้าฉีดวัคซีนในครั้งนี้ ได้รับความร่วมมือเป็นอย่างดีจากสำนักงานการศึกษาเอกชนอำเภอรามัน รวมทั้งผู้บริหารโรงเรียนและคณะครูเป็นอย่างดี
757,จังหวัดมุกดาหาร เร่งฉีดวัคซีนในเด็ก 12 - 18 ปี ที่ศึกษาอยู่ในระดับมัธยมศึกษาหรือเทียบเท่า เพื่อลดความรุนแรงและการเสียชีวิต จากการป่วยด้วยโรคติดเชื้อไวรัสโคโรนา 2019 ก่อนกลับมาเปิดเรียนที่ 2 ปีการศึกษา 2564 ต้นเดือน พ.ย.นี้
758,ที่ห้องประชุมจอมกิตติ ศาลากลางจังหวัดเชียงราย นายภาสกร บุญญลักษม์ ผู้ว่าราชการจังหวัดเชียงราย เป็นประธานการประชุมคณะกรรมการโรคติดต่อจังหวัดเชียงราย ครั้งที่ 35/2564 เพื่อติดตามสถานการณ์ การดำเนินงานเฝ้าระวัง ป้องกัน ควบคุมโรค พร้อมหารือการกำหนดมาตรการบริหารสถานการณ์โรคติดเชื้อไวรัสโคโรนา 2019 (COVID-19) เพื่อยับยั้งการแพร่ระบาดของโรค
759,"ที่โรงเรียนพิชัย อ.พิชัย จ.อุตรดิตถ์ นักเรียน นักศึกษา อายุ 12 – 18 ปี จำนวนกว่า 700 คน พร้อมใจเข้ารับการฉีดวัคซีนไฟเซอร์ (Pfizer) ป้องกันโรคโควิด-19 ซึ่งได้รับการจัดสรรวัคซีนรอบแรกจำนวนกว่า 1,600 โดส โดย อ.พิชัย มีนักเรียน นักศึกษา ลงทะเบียนขอรับการฉีดวัคซีนทั้งหมด 3,600 กว่าคน เพื่อเตรียมตัวให้พร้อมสำหรับการเปิดภาคเรียนที่ 2/2564 ในเดือน พ.ย.64 ภายใต้มาตรการป้องกันโรคโควิด-19 โดยมีนายสุรศักดิ์ วงศ์ตั้ง นายอำเภอพิชัย ผู้อำนวยการสำนักงานเขตพื้นที่การศีกษาประถมศึกษาอุตรดิตถ์ เขต 1 และเจ้าหน้าที่สาธารณสุข ร่วมให้บริการฉีดวัคซีนในครั้งนี้"
760,ที่ห้องประชุมจอมกิตติ ศาลากลางจังหวัดเชียงราย นายภาสกร บุญญลักษม์ ผู้ว่าราชการจังหวัดเชียงราย เป็นประธานการประชุมคณะกรรมการโรคติดต่อจังหวัดเชียงราย ครั้งที่ 35/2564 เพื่อติดตามสถานการณ์ การดำเนินงานเฝ้าระวัง ป้องกัน ควบคุมโรค พร้อมหารือการกำหนดมาตรการบริหารสถานการณ์โรคติดเชื้อไวรัสโคโรนา 2019 (COVID-19) เพื่อยับยั้งการแพร่ระบาดของโรค
761,เวลา 09.00-12.00 น ณ โครงการส่งน้ำและบำรุงรักษามูลล่าง (เขื่อนราษีไศล) สะพานแม่น้ำมูลราษีไศล และโรงพยาบาลราษีไศล อำเภอราษีไศล จังหวัดศรีสะเกษ นายวัฒนา พุฒิชาติ ผู้ว่าราชการจังหวัดศรีสะเกษ/ผู้อำนวยการศูนย์ป้องกันและบรรเทาสาธารณภัยจังหวัดศรีสะเกษ ตรวจติดตามสถานการณ์การระบายน้ำลำน้ำมูล ณ เขื่อนราษีไศล และสถานีวัดระดับน้ำ M5 สะพานราษีไศล ซึ่งการระบายน้ำยังคงไหลได้ต่อเนื่อง
762,เปิด 4 จุดบริการ ลงทะเบียนฉีดวัคซีนไฟเซอร์เข็มแรก ลดการแพร่ระบาดโควิด-19 ชาวยะลาตื่นตัวร่วมจองฉีดจำนวนมาก
763,บริษัทโมเดอร์นาออกแถลงการณ์เรียกร้องให้องค์การอาหารและยาสหรัฐ หรือ เอฟดีเออนุมัติฉีดวัคซีนโควิด-19 ของโมเดอร์นาเข็มกระตุ้นให้กลุ่มผู้สูงอายุและกลุ่มเสี่ยงสูง โดยข้อมูลของบริษัทบ่งชี้ว่าการฉีดวัคซีนเพื่อกระตุ้นภูมิเป็นประโยชน์ในด้านสาธารณสุข อีกทั้งยังช่วยลดจำนวนผู้ติดเชื้อหลังได้รับวัคซีนครบโดสแล้ว
764,"นายธีรศักดิ์ เด่นดวง รองนายแพทย์สาธารณสุขจังหวัดสิงห์บุรี พร้อมบุคลากรทางแพทย์ ฉีดวัคซีนโควิด-19 พร้อมทั้งสร้างความมั่นใจกับผู้ปกครองในการฉีดวัคซีนโควิด-19 Pfizer ให้กับนักเรียน นักศึกษาที่มีอายุ 12 ปีขึ้นไป ณ โรงเรียนบางระจัน อำเภอบางระจัน จังหวัดสิงห์บุรี ซึ่งจังหวัดสิงห์บุรีมีโรงเรียนและสถานศึกษาแจ้งความประสงค์ในการฉีดวัคซีนของนักเรียน จำนวน 130 แห่ง มีนักเรียน นักศึกษาที่มีอายุ 12 ปีขึ้นไปจำนวน 17,868 คน สมัครใจฉีดวัคซีนจำนวน 12,118 คน คิดเป็นร้อยละ 67.82 ในวันนี้ได้เปิดให้บริการฉีดวัคซีน Pfizer เข็มที่ 1 สำหรับนักเรียนนักศึกษาอายุ 12 ปีขึ้นไป ให้กับนักเรียนโรงเรียนบางระจันวิทยา จำนวนทั้งสิ้น 728 คน"
765,นายแพทย์ ทวีศิลป์ วิษณุโยธิน ผู้ตรวจราชการกระทรวงสาธารณสุข เขตสุขภาพที่ 10 เปิดกิจกรรมรณรงค์ฉีดวัคซีนป้องกันโรค COVID-19 ถวายเป็นพระราชกุศลในหลวงรัชกาลที่ 9 ที่จังหวัดมุกดาหาร
766,นายแพทย์ทวีศิลป์ วิษณุโยธิน ผู้ตรวจราชการกระทรวงสาธารณสุข เขตสุขภาพที่ 10 เปิดกิจกรรมรณรงค์ฉีดวัคซีนป้องกันโรค COVID-19 ถวายเป็นพระราชกุศล ในหลวงรัชกาลที่ 9 ที่จังหวัดมุกดาหาร
767,"โรงเรียนพิมานพิทยาสรรค์ จังหวัดสตูล นำนักเรียน 1,900 คน ฉีดวัคซีนโควิด-19 เตรียมพร้อมก่อนเปิดภาคเรียนที่ 2"
768,นักเรียนสังกัดสำนักงานเขตพื้นที่การศึกษาประถมศึกษาสตูล เข้ารับการฉีดวัคซีนไฟเซอร์ตามที่ได้รับการจัดสรรจากจังหวัด เน้นนักเรียนทุกคนต้องปลอดภัยจากโควิด-19 พร้อมเปิดภาคเรียนหน้าภายใต้ความปลอดภัย
769,วันที่ 13 ตุลาคม 2564 เวลา 13.00 น. ณ ห้องพญาตานี ศาลากลางจังหวัดปัตตานี นายนิพันธ์ บุญหลวง ผู้ว่าราชการจังหวัดปัตตานี ได้เรียกประชุมคณะกรรมการโรคติดต่อจังหวัดปัตตานี เพื่อติดตามสถานการณ์การแพร่ระบาดโควิด 19 จังหวัดปัตตานี และระดมทุกภาคส่วนของจังหวัด ปรับแผนการดำเนินการเพื่อลดจำนวนผู้ติดเชื้อ ให้ได้มากที่สุดก่อนสิ้นเดือนตุลาคม 2564
770,พลเอก ประยุทธ์ จันทร์โอชา นายกรัฐมนตรีและรัฐมนตรีว่าการกระทรวงกลาโหม เป็นประธานการประชุมศูนย์บริหารสถานการณ์การแพร่ระบาดของโรคติดเชื้อไวรัสโคโรนา 2019 หรือ ศบค. โดยวาระที่น่าสนใจคือ การการพิจารณามาตรการแนวทางการเตรียมความพร้อมด้านต่างๆ เพื่อรองรับการเปิดประเทศให้นักท่องเที่ยวต่างชาติเข้ามาในวันที่ 1 พฤศจิกายนนี้ รวมถึงการพิจารณากลุ่มประเทศเสี่ยงต่ำ ซึ่งการท่องเที่ยวแห่งประเทศไทย (ททท.) อาจเสนอเพิ่มเป็น 20 ประเทศ
771,ยะลา ฉีดไฟเซอร์ เข็มแรก ให้ประชาชนทั่วไป ด้าน รมต.สธ.เตรียมลงพื้นที่ ติดตามสถานการณ์ เร่งลดการแพร่ระบาดโควิด  บ่ายนี้
772,ตชด.ลาดตระเวน พบชายเมียนมาร์นั่งร้องไห้ริมรั้วชายแดน ไทย-มาเลเซีย ในพื้นที่ อ.เบตง จ.ยะลา บอกอยากกลับประเทศ แต่เถ้าแก่ยึดหนังสือเดินทางไว้ จึงแอบหนีมุดรั้วลวดหนามเข้าไทย
773,"วัดอุดมธานี พระอารามหลวงจัดประชุมเตรียมความพร้อม พิธีถวายผ้าพระกฐินพระราชทานของกรมสวัสดิการและคุ้มครองแรงงาน ตามที่ขอพระราชทาน พระบาทสมเด็จพระเจ้าอยู่หัว ทรงพระกรุณาโปรดเกล้าฯ พระราชทานผ้าพระกฐิน ให้กรมสวัสดิการและคุ้มครองแรงงาน ตามที่ขอพระราชทาน เพื่อนำไปถวายพระสงฆ์จำพรรษาถ้วนไตรมาส ณ วัดอุดมธานี พระอารามหลวง ตำบลบ้านใหญ่ อำเภอเมือง จังหวัดนครนายก ในวันที่ 6 พฤศจิกายน 2564 โดย พระครูปริยัติโพธิสุนทร เจ้าคณะอำเภอเมือง เจ้าอาวาสวัดอุดมธานี พระอารามหลวง ได้จัดให้มีการประชุมเตรียมความพร้อม พิธีถวายผ้าพระกฐินพระราชทานของกรมสวัสดิการและคุ้มครองแรงงาน ประจำปี 2564 โดยมี นายอาทร นุ่นสังข์ เลขานุการกรมสวัสดิการและคุ้มครองแรงงาน พร้อมเจ้าหน้าที่ สำนักงานพระพุทธศาสนาจังหวัดนครนายก,สำนักงานวัฒนธรรมจังหวัดนครนายก และไวยาวัจกร เข้าร่วมประชุม โดยการจัดงานจะต้องเป็นไปตามมาตรการของกระทรวงสาธารณสุข และประกาศ/คำสั่งของทางจังหวัด อย่างเคร่งครัด"
774,"สถานการณ์โรคติดเชื้อไวรัสโควิด-19 ในพื้นที่จังหวัดพะเยา พบผู้ติดเชื้อรายใหม่เพิ่มจำนวน 14 ราย ติดเชื้อมาจากต่างจังหวัด 5 ราย และติดเชื้อในพื้นที่ จำนวน 9 ราย โดยรายแรก เพศชาย อายุ 31 ปี ภูมิลำเนาตำบลจำป่าหวาย อำเภอเมือง จังหวัดพะเยา อาชีพตำรวจ เดินทางมาจากจังหวัดชัยนาทและมีบุคคลในครอบครัวเป็นผู้ป่วยติดเชื้อโควิด-19, รายที่ 2 - 5 รวมจำนวน 4 ราย อายุ 29 ปี 30 ปี 8 ปี และ 23 ปี ภูมิลำเนาอำเภอปง จังหวัดพะเยา อาชีพค้าขาย เดินทางมาจากกรุงเทพฯ, รายที่ 6 เพศหญิง อายุ 36 ปี ภูมิลำเนาตำบลสบบง อำเภอภูซาง จังหวัดพะเยา อาชีพครู ติดเชื้อจากบุคคลในครอบครัว, รายที่ 7 เพศชาย อายุ 6 ปี ภูมิลำเนาตำบลทุ่งกล้วย อำเภอภูซาง จังหวัดพะเยา อาชีพ นักเรียน ติดเชื้อจากโรงเรียนและอยู่ในระหว่างการสอบสวนโรคเพิ่มเติม, รายที่ 8-14 รวมจำนวน 7 ราย เป็นเพศชาย อาชีพรับจ้าง ภูมิลำเนาอยู่ในพื้นที่อำเภอเมืองพะเยา ทุกรายสัมผัสใกล้ชิดและอยู่ในสถานที่เดียวกับผู้ป่วยโควิด-19 และผู้ที่ไปชนไก่ที่ตำบลบ้านเอื้อม อำเภอเมืองลำปาง"
775,อนุทิน ลงใต้ตรวจเยี่ยมให้กำลังใจ และติดตามมาตรการป้องการการแพร่ระบาดของโควิด 19 ใน 4 จังหวัดชายแดนใต้ เตรียมส่งวัคซีนกว่าล้านโดสปูพรมฉีดครอบคลุมกลุ่มเป้าหมายให้ได้ 70 เปอร์เซ็น เพื่อปิดเกมการแพร่ระบาดในจังหวัดชานแดนใต้ ด้านรัฐมนตรีท่องเที่ยวฯ เผยเปิดจังหวัดชายแดนมาเลเซียได้ ธ.ค. นี้ หากวัคซีนเป็นไปตามเป้า ยันไม่กระทบเค้าท์ดาวน์ ดันหาดใหญ่เป็นอีกจุดหลักจัดกิจกรรมในภาคใต้
776,เช้าวันนี้ (14 ต.ค.64) ที่สโมสรนายทหารสัญญาบัตร ค่ายกฤษณ์สีวะรา อำเภอเมือง จังหวัดสกลนคร มณฑลทหารบกที่ 29 ให้การสนับสนุนจังหวัดสกลนคร โดยมีบุคลากรทางการแพทย์จากโรงพยาบาลค่ายกฤษณ์สีวะรา เปิดจุดให้บริการฉีดวัคซีนโควิด-19 (Pfizer) เป็นเข็มที่ 1 ให้กับนักเรียนจากโรงเรียนวิถีธรรมราชภัฏสกลนคร และโรงเรียนเซนยอเซฟ สกลนคร จำนวน 175 คน ไม่มีผู้ได้รับผลข้างเคียงที่รุนแรงแต่อย่างใด โดยกระทรวงสาธารณสุขแนะนำ หลังฉีดห้ามออกกำลังกาย 2 สัปดาห์
