,news_text
0,"นายสุวพงศ์ กิติภัทย์พิบูลย์ ผู้ว่าราชการจังหวัดสุรินทร์ เปิดเผยว่า จังหวัดสุรินทร์พบมีผู้ป่วยยืนยันโรคติดเชื้อโควิด-19 นับตั้งแต่มีการระบาดระลอกใหม่ ถึงวันที่ 31 สิงหาคม 2564 สะสมกว่า 12,541 ราย รักษาหายแล้วกว่า 8,606 ราย เสียชีวิต 40 ราย ซึ่งจังหวัดสุรินทร์ได้เน้นย้ำให้ทุกคนปฏิบัติตาม มาตรการด้านสาธารณสุขอย่างเข้มงวด"
1,สำนักงานประชาสัมพันธ์จังหวัดแพร่รายงานว่า วันนี้ (1ก.ย.64) เวลา 13.30 น. ณ ห้องประชุมเวียงโกศัย ศาลากลางจังหวัดแพร่ นายสมหวัง พ่วงบางโพ ผู้ว่าราชการจังหวัดแพร่ เป็นประธานการประชุมคณะกรรมการโรคติดต่อครั้งที่ 30/2564 ร่วมกับคณะทำงานศูนย์ปฏิบัติการควบคุมโรคหน่วยงานภาครัฐและเอกชนที่เกี่ยวข้องเพื่อรับทราบสถานการณ์โรคโควิด-19 ผลการดำเนินงานให้บริการวัคซีนของจังหวัดแพร่
2,วันนี้ 1 ก.ย.64 นายอิสมาแอ มะสาลัง อิหม่ามประจำมัสยิดอัสซุนนะฮ์ บ้านกาแป๊ะฮูลู พร้อมคณะกรรมการมัสยิด ได้เดินทางเข้ารับการฉีดวัคซีนโควิด 19 ที่โรงพยาบาลเบตง โดยมีบุคลากรทางการแพทย์ โรงพยาบาลเบตง บริการฉีดวัคซีนให้เข็มแรกและเข็มที่สอง ไฟเซอร์ และแอสตร้าเซนเนก้า รวมไปถึงทีมงาน The Kop Betong ที่เข้ารับการฉีดวัคซีน ชิโนฟาร์ม ทั้งนี้เพื่อสร้างภูมิคุ้มกันหมู่ในอำเภอเบตง
3,กองกำลังป้องกันอิสราเอล ประกาศเตรียมกำหนดให้กำลังพลของกองทัพเข้ารับการฉีดวัคซีนโควิด-19 ของไฟเซอร์-ไบโอเอ็นเทค เข็มที่ 3 หรือวัคซีนเข็มกระตุ้น หลังฉีดวัคซีนเข็มที่ 2 มาแล้ว อย่างน้อย 5 เดือน เพื่อยกระดับการควบคุมการระบาดของเชื้อโควิด-19 สายพันธุ์เดลตา หลังทางการอิสราเอลขยายโครงการฉีดวัคซีนโควิด-19 เข็มที่ 3 ให้ครอบคลุมประชาชนที่มีอายุ 12 ปีขึ้นไป รวมถึงบุคลากรทางการศึกษา บุคลากรทางการแพทย์ และหญิงตั้งครรภ์ ทุกช่วงอายุ
4,"คณะรัฐมนตรีมีมติอนุมัติวงเงิน 4,745 ล้านบาท สำหรับการจัดซื้อวัคซีนไฟเซอร์ เพิ่มเติมอีก จำนวน 9,998,820 โดส เพื่อเสริมสร้างภูมิคุ้มกันโรคแก่กลุ่มเป้าหมายหลัก 6 กลุ่ม ได้แก่"
5,นายแพทย์เกียรติภูมิ วงศ์รจิต ปลัดกระทรวงสาธารณสุข กล่าวว่า ในการบริหารจัดการเรื่องวัคซีน ดำเนินการภายใต้คณะกรรมการวิชาการจากทุกสาขาได้คิดค้น พัฒนา ปรับปรุง ทั้งการส่งเสริมสุขภาพ ป้องกันโรค ดูแลบำบัดรักษาและให้วัคซีนครบวงจร ตั้งแต่เดือนกุมภาพันธ์ถึงปัจจุบัน ฉีดไปแล้ว 32 ล้านโดส เป็นไปตามแผนการจัดการวัคซีน ซึ่งเป็นการใช้ทรัพยากรที่มีอย่างจำกัดและคุ้มค่าที่สุดภายใต้หลักฐานทางวิชาการที่ได้มีการวิจัย ทดลอง สังเกต นำมาประยุกต์ใช้  โดยวัคซีนสูตรไขว้ซิโนแวคตามด้วยแอสตร้าเซนเนก้า จะเป็นวัคซีนพื้นฐานที่ฉีดให้กับประชาชน ยืนยันว่ามีความปลอดภัย ระยะต่อไปเมื่อมีวัคซีนเข้ามามากขึ้น ทั้งแอสตร้าเซนเนก้า ไฟเซอร์ โมเดิร์นนา ซิโนฟาร์ม จะหาแนวทางเพิ่มประสิทธิภาพวัคซีน ให้ทันกับสถานการณ์สู้กับการกลายพันธุ์ของไวรัสเพื่อประโยชน์สูงสุดแก่ประชาชน
6,"จังหวัดอุดรธานีกลุ่มเสี่ยง 608 ที่ฉีด ""แอสตราฯ"" เข็มแรกต้องการบูสเข็ม 2 ด้ว ""ไฟเซอร์"" แจ้งหน่วยฉีดใกล้บ้านก่อนวันที่ 14 กันยายนนี้"
7,"วันนี้ (2 กันยายน 2564) ศูนย์ปฏิบัติการฉุกเฉินด้านการแพทย์และสาธารณสุขจังหวัดเลย รายงานสถานการณ์โรคโควิด-19 ในจังหวัดเลย ซึ่งวันนี้พบผู้ป่วยติดเชื้อโควิด-19 เพิ่มขึ้น จำนวน 19 ราย โดยเป็นผู้ป่วยที่ติดเชื้อในพื้นที่ 2 ราย และนอกพื้นที่ 17 ราย รวมมีผู้ป่วยสะสมแล้ว จำนวน 2,632 ราย กำลังรักษาตัวอยู่ 455 ราย หายป่วยกลับบ้านวันนี้ 24 ราย และยังคงมีผู้สัมผัสเสี่ยงสูงต้องติดตามอีก 309 ราย สำหรับผู้ป่วยที่ติดเชื้อในพื้นที่ 2 ราย เพศหญิง อายุ 49 ปี มีภูมิลำเนาบ้านโนนถาวร ตำบลเอราวัณ อำเภอเอราวัณ และเพศชาย อายุ 65 ปี ภูมิลำเนาบ้านโป่งศรีโทน ตำบลเอราวัณ อำเภอเอราวัณ  มีประวัติสัมผัสเสี่ยงกับผู้ป่วยยืนยันก่อนหน้านี้"
8,"นายสุวัฒน์ อุบลทัศนีย์ นักวิชาการสาธารณสุขชำนาญการ กลุ่มงานควบคุมโรคติดต่อ สำนักงานสาธารณสุขจังหวัดสุพรรณบุรี เปิดเผยว่า ภาพรวมสถานการณ์โควิด -19 ของจังหวัดสุพรรณบุรี เรามีผู้ป่วยตั้งแต่เริ่มต้นจนถึงปัจจุบัน อยู่ที่ประมาณ 9,000 กว่ารายราย ยังรักษาตัวประมาณ 1,700 กว่าราย และรักษาหายแล้ว 7,200 กว่าราย ขณะที่ภาพรวมตลอด 1 ปีที่ผ่าน เราจะพบเด็กที่ติดโควิดจากเชื้อ SARS-CoV-2 ซึ่งภาพรวมของประเทศจะพบอยู่ที่ ร้อยละ 13 ของผู้ป่วยทั้งหมด แต่ส่วนใหญ่จะไม่พบอาการรุนแรง หรือไม่แสดงอาการเลย นอกจากเด็กที่เป็นโรคอ้วนซึ่งก็เป็นส่วนน้อย ส่วนที่สุพรรณบุรี ในกลุ่มเด็กที่มีอายุต่ำกว่า 12 ปี ที่ติดเชื้อโควิดอยู่จำนวน 978 ราย คิดเป็นร้อยละ 10.45 ยังต่ำกว่าระดับประเทศ แต่การดูแลรักษาจะต้องมีการดูแลรักษาและระมัดระวังเป็นพิเศษ เนื่องจากเด็กบางคนยังช่วยเหลือตัวเองไม่ได้ โดยมีเงื่อนไขแบ่งเป็น 3 กรณี คือ 1. เด็กและผู้ปกครอง/คนในครอบครัวติดด้วย ซึ่งสามารถดูแลควบคู่ไปด้วยได้  2. เด็กติดเชื้อ แต่ผู้ปกครองไม่ติด ผู้ปกครองที่จะมาดูแลเด็ก อายุต้องไม่เกิน 60 ปี และต้องสวมแมส 100 % ห้ามใช้มือสัมผัส ปาก จมูก  3. ผู้ปกครองติด เด็กไม่ติด แต่เด็กติดผู้ปกครอง ต้องพยายามหาญาติที่เด็กไว้ใจแยกไปต่างหาก หรือหากหลีกเลี่ยงไม่ได้จริงๆ ผู้ปกครองต้องสวมแมสตลอดเวลา ต้องระมัดระวังอย่าใช้มือสัมผัส ปาก จมูก หน้า ตา ของเด็ก ส่วนการรักษาพยาบาลสำหรับเด็ก จะต้องอยู่ในโรงพยาบาลเป็นหลัก มีกุมารแพทย์ดูแล และคอยให้คำปรึกษา และคำแนะนำกับผู้ปกครอง ตลอดจนการพูดคุยตามหลักจิตวิทยาเพื่อให้ทั้งเด็กและผู้ปกครองคลายความวิตกกังวล"
9,"นางสุนิสา รามแก้ว ประชาสัมพันธ์จังหวัดสุราษฎร์ธานี กล่าวว่า คณะรัฐมนตรีมีมติอนุมัติวงเงิน 4,745 ล้านบาท สำหรับการจัดซื้อวัคซีนไฟเซอร์ เพิ่มเติมอีก จำนวน 9,998,820 โดส เพื่อเสริมสร้างภูมิคุ้มกันโรคแก่กลุ่มเป้าหมายหลัก 6 กลุ่ม ได้แก่ กลุ่มเด็กอายุ 12-17 ปี หญิงตั้งครรภ์ที่มีอายุครรภ์ตั้งแต่ 12 สัปดาห์ขึ้นไป บุคลากรทางการแพทย์และสาธารณสุขด่านหน้า(ฉีดกระตุ้นภูมิเข็มที่หนึ่ง) ผู้สูงอายุและผู้มีกลุ่ม 7 โรคเสี่ยง ชาวต่างชาติที่อาศัยอยู่ในประเทศไทย เน้นผู้สูงอายุ และโรคเรื้อรัง และผู้ที่มีความจำเป็นต้องการฉีดวัคซีนไฟเซอร์ก่อนเดินทางไปต่างประเทศ เช่น นักเรียน นักศึกษา นักกีฬา นักการทูต เป็นต้น โดยกลุ่มเป้าหมายสามารถปรับเปลี่ยนให้สอดคล้องกับสถานการณ์การแพร่ระบาดของโรคได้"
10,นายจำเริญ ทิพญพงศ์ธาดา ผู้ว่าราชการจังหวัดพังงา กล่าวว่า จังหวัดพังงาออกคำสั่งจังหวัดพังงา ที่ 2674/2564 กำหนดมาตรการเข้า-ออกจังหวัดพังงา มีผลตั้งแต่วันที่ 1 -15 กันยายน 2564 เพื่อเป็นการเฝ้าระวัง ควบคุม ป้องกันการแพร่ระบาดของโรคโควิด-19 โดยได้กำหนดมาตรการเข้า-ออก จังหวัดพังงา ดังนี้
11,วันที่ 2 กันยายน 2564 เวลา 13.40 น. ที่ โรงพยาบาลเสนา อ.เสนา จ.พระนครศรีอยุธยา นางสรัลพัชร ประโมทะกะ รองผู้ว่าราชการจังหวัดพระนครศรีอยุธยา  เดินทางไปตรวจเยี่ยมให้กำลังใจเจ้าหน้าที่และประชาชนจุดบริการฉีดวัคซีน ณ จุดฉีดวัคซีนอาคาร 100 ปี สธ. และอาคาร 40 ปี โรงพยาบาลเสนา โดยมี นายวัชรินทร์ รื่นถวิล นายอำเภอเสนา ดร.นพ.วัฒน์ชัย จรูญวรรธนะ ผอ.รพ.เสนา รองผู้อำนวยการฝ่ายการแพทย์ ผู้ช่วยผู้อำนวยการกลุ่มภารกิจด้านปฐมภูมิ และเจ้าหน้าที่ที่เกี่ยวข้อง ให้การต้อนรับและให้ข้อมูล สำหรับวันนี้เป็นการฉีดวัคซีน SINOVAC เข็มที่ 1 ในกลุ่มประชาชนทั่วไป จำนวน 260 ราย AstraZeneca เข็มที่ 2 จำนวน 555 ราย และ Pfizer สำหรับทุกกลุ่มอายุผู้สูงอายุ กลุ่มผู้ป่วย 7 โรคเรื้อรัง และประชาชนทั่วไป อายุ 18 - 59 ปี จำนวน 540 ราย นอกจากนี้ ยังให้บริการฉีดวัคซีนเชิงรุกนอกสถานที่ให้กลุ่มเปราะบาง ผู้ป่วยติดเตียง โดยการสำรวจและประสานงานจากผู้นำชุมชนอีกด้วย
12,ศูนย์ควบคุมและป้องกันโรคของสหรัฐหรือซีดีซี รายงานว่า สหรัฐฯ ดำเนินการฉีดวัคซีนโควิด-19 ชนิดเอ็มอาร์เอ็นเอ ของไฟเซอร์-ไบโอเอ็นเทค หรือโมเดอร์นา เข็มที่ 3 ให้ประชาชนกลุ่มเสี่ยงสูงแล้ว กว่า 1 ล้านคน นับตั้งแต่วันที่ 13สิงหาคม ที่ผ่านมา หลังซีดีซีและสำนักงานคณะกรรมการอาหารและยาของสหรัฐฯ หรือเอฟดีเอ อนุมัติเป็นกรณีฉุกเฉินให้ดำเนินการฉีดวัคซีนโควิด-19 เข็มกระตุ้น แก่ผู้ที่มีภูมิคุ้มกันอ่อนแอ อาทิ ผู้ป่วยมะเร็ง ผู้ที่ใช้ยากดภูมิคุ้มกัน หรือผู้ที่ผ่านการปลูกถ่ายอวัยวะ
13,"กระทรวงสาธารณสุขอิสราเอล รายงานพบผู้ติดเชื้อโควิด-19 รายใหม่ 11,187 คน ซึ่งเป็นยอดผู้ติดเชื้อรายวันที่สูงที่สุด นับตั้งแต่พบการแพร่ระบาดโรคโควิด-19 ทำให้ในเวลานี้ อิสราเอลมียอดผู้ติดเชื้อสะสม รวมกว่า 1,088,000 คน และมียอดผู้เสียชีวิต 7,090 คน"
14,เมื่อเวลา 08.00 น. วันที่ 2 กันยายน 2564 รอ.นพ.ภูรีวรรธน์ โชคเกิด สาธารณสุขนิเทศก์ เขตสุขภาพที่ 10 พร้อมด้วย นพ.ทนง วีระแสงพงษ์ นายแพทย์สาธารณสุขจังหวัดศรีสะเกษ นพ.พิเชษฐ์ จงเจริญ รองนายแพทย์สาธารณสุขจังหวัดศรีสะเกษ ตรวจเยี่ยมให้กำลังใจบุคลากรทางการแพทย์ เจ้าหน้าที่สาธารณสุข เจ้าหน้าที่ผู้ปฏิบัติงาน และผู้เข้ารับการฉีดวัคซีน      โดยมี นายพรชัย วงศ์งาม นายอำเภออุทุมพรพิสัย  นายอาสพลธ์ สรรณ์ไตรภพ สมาชิกสภาผู้แทนราษฎร เขต 7 จังหวัดศรีสะเกษ  นพ.อัครเดช บุญเย็น ผู้อำนวยการโรงพยาบาลอุทุมพรพิสัย  นายปรีชา ปิยะพันธ์ สาธารณสุขอำเภออุทุมพรพิสัย นายสมพงษ์ จิริวิภากร นายกเทศมนตรีตำบลกำแพง และจิตอาสาพระราชทาน ร่วมให้การต้อนรับ ณ หอประชุมที่ว่าการอำเภออุทุมพรพิสัย อำเภออุทุมพรพิสัย จังหวัดศรีสะเกษ
15,โรงพยาบาลสกลนคร จัดบริการวัคซีนเข็ม 2 จำนวนกว่า 500 คน พร้อมให้กลุ่มผู้สูงอายุ 60 ปีขึ้นไป และกลุ่มผู้ป่วย 7 โรคเรื้อรัง สามารถเลือกฉีดวัคซีน Astra Zeneca หรือ Pfizer ได้ตามความต้องการ
16,"(3 ก.ย. 64) สำนักงานประชาสัมพันธ์จังหวัดตราด รายงานว่า คณะรัฐมนตรีมีมติอนุมัติวงเงิน 4,745 ล้านบาท สำหรับการจัดซื้อวัคซีนไฟเซอร์ เพิ่มเติมอีก จำนวน 9,998,820 โดส เพื่อเสริมสร้างภูมิคุ้มกันโรคแก่กลุ่มเป้าหมายหลัก 6 กลุ่ม ได้แก่"
17,ศูนย์ข้อมูลโควิด-19 จังหวัดลำปาง เปิดเผยมาตรการการควบคุมสถานการณ์การแพร่ระบาดในพื้นที่ ซึ่งบุคคลที่เดินมาจากพื้นที่สีแดงเข้ม และพื้นที่สีแดง (พื้นที่ควบคุมสูงสุดและเข้มงวด 29 จังหวัด และพื้นที่ควบคุมสูงสุด 37 จังหวัด) ให้ทุกคนลงทะเบียนเข้าพื้นที่ผ่าน QR Code “ลำปางชนะ” และให้รายงานตัวต่อเจ้าพนักงานควบคุมโรคในพื้นที่ โดยแจ้งได้ที่ อสม. หรือ จนท.สาธารณสุข รพ.สต. หรือผู้ใหญ่บ้าน หรือกำนัน นอกจากนี้ ให้กักตัวเองที่บ้าน หรือที่พัก หรือที่กักตัวในชุมชน เป็นเวลาอย่างน้อย 14 วัน
18,นายกรัฐมนตรีสกอตต์ มอร์ริสัน ของออสเตรเลียประกาศเมื่อวานนี้ว่า อังกฤษจะส่งมอบวัคซีนโควิด-19 ของไฟเซอร์/ไบโอเอ็นเทค อีก 4 ล้านโดส ให้ออสเตรเลียในไม่กี่สัปดาห์นี้ ภายใต้สัญญาแลกเปลี่ยนวัคซีนระหว่างกัน
