,news_text
344,นายเกริกชัย ผ่องแผ้ว รองผู้ว่าราชการจังหวัดอุบลราชธานี รายงานถึงสถานการณ์ผู้ติดเชื้อโควิด 19 วันที่ 15 สิงหาคม 2564 จังหวัดอุบลราชธานี พบผู้ติดเชื้อรายใหม่ จำนวน 266 ราย โดย ติดเชื้อจาก กทม.และต่างจังหวัด 254 ราย ติดเชื้อในพื้นที่ 12 ราย โดย อ.เมืองอุบลฯ 5 ราย พิบูลมังสาหาร และ เดชอุดม พื้นที่ละ 2 ราย วารินชำราบ สำโรง และสิรินธร พื้นที่ละ 1 ราย ผู้ป่วยรักษาหายเพิ่มอีก 231ราย  เสียชีวิตเพิ่ม 1 ราย เป็นชาย อายุ 30 ปี ชาว ต.คำเจริญ อ.ตระการพืชผล มาจากจังหวัดสมุทรปราการ ไม่มีโรคประจำตัว ยังไม่ได้ฉีดวัคซีน เริ่มป่วยวันที่ 2 ส.ค. มีอาการ ไข้ เจ็บคอ กลับมารักษาที่ จังหวัดอุบลราชธานี วันที่ 7 ส.ค. เสียชีวิตวันที่ 14 ส.ค.
345,จังหวัดอุบลราชธานี มีผู้ป่วยรักษาหายเพิ่มกว่า 200 ราย ส่วนติดเชื้อรายใหม่และในพื้นที่ลดลง
346,"นายแพทย์เฉวตสรร นามวาท ผู้อำนวยการกองควบคุมโรคและภัยสุขภาพในภาวะฉุกเฉิน กรมควบคุมโรค แถลงสถานการณ์โควิด-19 วันนี้ (15 ส.ค.64) ว่า พบผู้ติดเชื้อรายใหม่ในประเทศ 21,882 ราย ขณะเดียวกันมีผู้หายป่วยกลับบ้าน 21,106 ราย ซึ่งถือว่าอยู่ในระดับใกล้ที่เคียงกัน ขณะที่วันนี้มีผู้เสียชีวิต 209 ราย ส่วนใหญ่เป็นผู้สูงอายุ 60 ปี ขึ้นไป กว่าร้อยละ 66 และผู้ที่อายุน้อยกว่า 60 ปี มีโรคเรื้อรัง คิดเป็นร้อยละ 23 รวมจำนวนสองส่วนคิดเป็นร้อยละ 89 ถือว่าเป็นจำนวนที่สูง จึงต้องเร่งฉีดวัคซีนให้กลุ่มเหล่านี้เพิ่มขึ้น เพื่อลดการเจ็บป่วยรุนแรงและเสียชีวิต นอกจากนี้ยังพบรายงานการเสียชีวิตเป็นหญิงตั้งครรภ์ 2 ราย ที่จังหวัดร้อยเอ็ดและศรีษะเกษ ส่วนปัจจัยเสี่ยงการเสียชีวิตในภาพรวม ได้แก่ โรคความดันโลหิตสูง เบาหวาน ไขมันในเลือดสูง และภาวะอ้วน"
347,บรรยากาศการฉีดวัคซีนที่หน่วยบริการฉีดวัคซีน อำเภอเมืองยะลา อาคารศรีนิบง ศูนย์เยาวชนเทศบาลนครยะลา  วันนี้ (16 ส.ค 64)  ซึ่งทางโรงพยาบาลยะลาได้เชิญชวนให้ประชาชน กลุ่มอายุ 60 ปี ขึ้นไป ผู้มีโรคประจำตัว 7 กลุ่มโรค หญิงตั้งครรภ์ 12 สัปดาห์ขึ้นไป ที่มีบัตรประจำตัวประชาชน หรือทะเบียนบ้านในจังหวัดยะลา มาฉีดวัคซีน ป้องกันโควิด-19 ในเข็มแรกซิโนแวค เข็มสองแอสตร้าเซเนก้า โดยไม่ต้องมีใบนัด หรือบัตรคิวตามนโยบายของกระทรวงสาธารณสุข
348,นายเกริกชัย ผ่องแผ้ว รองผู้ว่าราชการจังหวัดอุบลราชธานี รายงานถึงสถานการณ์ผู้ติดเชื้อโควิด 19 วันที่ 16 สิงหาคม 2564 จังหวัดอุบลราชธานี พบผู้ติดเชื้อรายใหม่ จำนวน 283 ราย โดย ติดเชื้อจาก กทม.และต่างจังหวัด 237 ราย ติดเชื้อในพื้นที่ 46 ราย โดย อ.เมืองอุบลฯ 11 ราย  วารินชำราบ สำโรง เดชอุดม พื้นที่ละ 6 ราย สว่างวีระวงศ์ ศรีเมืองใหม่ เขมราฐ  เขื่องใน พื้นที่ละ 3 ราย โขงเจียม 2 ราย นาจะหลวย นาตาล สิรินธร พื้นที่ ละ 1 ราย มีผู้ป่วยรักษาหายเพิ่มอีก 153 ราย
349,โรงพยาบาลนราธิวาสราชนครินทร์ เชิญชวนประชาชน ฉีดวัคซีนโควิด-19 ( PFIZER ) โดยกำหนดการฉีดวัคซีนโควิด-19 ( PFIZER ) เข็มที่ 1 ในวันที่ 16-19 สิงหาคม 2564 ตั้งแต่เวลา 08.00-15.30 น. โดยจำกัดเฉพาะผู้ที่มีภูมิลำเนาในจังหวัดนราธิวาสเท่านั้น (จำนวนจำกัด ) ณ อาคารเอนกประสงค์โรงพยาบาลนราธิวาสราชนครินทร์
350,นายแพทย์เจ๊ะอิดเร๊ะ ดือเระผู้อำนวยการโรงพยาบาลปัตตานี พร้อมคณะแพทย์ หมอ และพยาบาล จากโรงพยาบาลปัตตานี ได้กำหนดกลุ่มเป้าหมายผู้ป่วยโรคเรื้อรังตามเกณฑ์ที่กำหนด เข้ารับการ ฉีดวัคซีนไฟเซอร์ เข็ม 1 ฉีด ในวันที่ วันที่ 16-20 สิงหาคม 2564 เวลา 08.30-16:00 น. ที่ หอประชุมองค์การบริหารส่วนจังหวัดปัตตานี เพื่อลดความรุนแรงและป้องกันการแพร่ระบาดของโรคโควิด-19 ในจังหวัดปัตตานีโดยเร็วที่สุด โดยมีประชาชนกลุ่มเป้าหมายผู้ป่วยโรคเรื้อรังตามเกณฑ์ที่กำหนด ให้ความสนใจเข้ารับการฉีดอย่างต่อเนื่อง
351,นายแพทย์ ทวีศิลป์ วิษณุโยธิน โฆษกศูนย์บริหารสถานการณ์โควิด-19 (ศบค.) กล่าวว่า ที่ประชุม ศบค. ได้เห็นชอบในหลักการจัดหาวัคซีนในช่วงเดือนสิงหาคม-กันยายน 2564 เพื่อนำมาใช้ในช่วงที่ระยะเวลาที่วัคซีนมีจำกัดเพิ่มเติม เนื่องจากปัญหาสายพันธุ์ Delta ที่วัคซีนที่ใช้ในปัจจุบันมีประสิทธิภาพในการป้องกันการติดเชื้อได้น้อยจึงควรเร่งการฉีดวัคซีนเพื่อเพิ่มความครอบคลุมในทุกกลุ่มเป้าหมาย ซึ่งต้องได้วัคซีน 100 ล้านโดส ในปี 2564 โดยการเจรจาจัดหาวัคซีนเพิ่มจากบริษัทผู้ผลิตที่สามารถส่งมอบวัคซีนได้โดยเร็วที่สุด ได้แก่ จองซื้อวัคซีนจากบริษัท Pfizer เพิ่มเติมอีกจำนวน 10 ล้านโดส (ผ่าน ศบค. 1 ส.ค. 64) ให้องค์การเภสัชกรรม (GPO) จัดหาวัคซีน Sinovac เพิ่มเติมอีกจำนวน 12 ล้านโดส และให้เจรจาจัดหาวัคซีนอื่น ๆ เพิ่มเติมอีกจำนวน 10 ล้านโดส ภายในปี 2564
352,"นายแพทย์ทวีศิลป์ วิษณุโยธิน โฆษกศูนย์บริหารสถานการณ์การแพร่ระบาดของโรคติดเชื้อไวรัสโคโรนา 2019 หรือ ศบค. กล่าวว่า สำหรับแผนการให้บริการวัคซีนโควิด-19 โดยสรุปผลการฉีดวัคซีนข้อมูล ณ วันที่ 15 สิงหาคม จำนวนวัคซีนที่ให้บริการทั้งสิ้น 23,592,227 โดส ผู้ได้รับวัคซีนอย่างน้อยหนึ่งเข็มจำนวน 17,996,826 คน ผู้ที่ได้รับวัคซีนครบสองเข็มจำนวน  5,109,476 คน และผู้ได้รับวัคซีนไขว้เข็มหนึ่งและเข็มสอง แอสตร้าเซนเนก้าและซิโนแวค  จำนวน 974,563 คน โดยยังไม่พบอาการที่ไม่พึงประสงค์และอาการที่รุนแรง และมีผู้ได้รับการฉีดวัคซีนเข็มกระตุ้นด้วยแอสตร้าเซนเนก้า จำนวน 195,520 คน"
353,กรมควบคุมโรค โดยสำนักงานป้องกันและควบคุมโรคที่ 2 รายงานสถานการณ์การฉีดวัคซีน COVID-19 ของจังหวัดในเขตสุขภาพที่ 2 มีความก้าวหน้าของการฉีดวัคซีน Sinovac เข็มที่ 1 และ 2 สะสมเทียบกับยอดวัคซีนที่ได้รับจัดสรร (Sinovac) คิดเป็นร้อยละ 89.39
354,"นายแพทย์โอภาส การย์กวินพงศ์ อธิบดีกรมควบคุมโรค กระทรวงสาธารณสุข กล่าวว่า สัปดาห์ก่อนเน้นส่งวัคซีนไฟเซอร์ให้กลุ่มบุคลากรทางการแพทย์ แต่สัปดาห์นี้กรมควบคุมโรค ได้จัดสรรไฟเซอร์เพิ่มสำหรับกลุ่ม 608 มากขึ้นคือ ผู้สูงอายุ 60 ปีขึ้นไป ผู้มีโรคเรื้อรัง 7 โรค และหญิงตั้งครรภ์ 12 สัปดาห์ขึ้นไป เพื่อฉีดในเดือนสิงหาคม 2564 จำนวน 645,000 โดส ใน 13 จังหวัดควบคุมสูงสุดและเข้มงวด ประกอบด้วย กรุงเทพมหานคร ฉะเชิงเทรา ชลบุรี นครปฐม นนทบุรี นราธิวาส ปทุมธานี ปัตตานี พระนครศรีอยุธยา ยะลา สงขลา สมุทรปราการ และสมุทรสาคร ซึ่ง รพ. หลายแห่งได้เริ่มฉีดแล้ว เช่น สมุทรปราการ ฉะเชิงเทรา คาดว่าทุกแห่งจะดำเนินการได้ในสัปดาห์นี้ โดยตั้งแต่วันที่ 28 กุมภาพันธ์เป็นต้นมา มีผู้ได้รับการฉีดวัคซีนแล้ว 24 ล้านโดส โดยเป็นเข็มที่ 1 จำนวน 18.3 ล้านคน ความครอบคลุมร้อยละ 25.5 เป็นผู้ฉีดครบ 2 เข็ม จำนวน 5.2 ล้านคน ความครอบคลุมร้อยละ 7.1 และฉีดกระตุ้นเข็ม 3 อีก 500,000 คน ในจำนวนนี้เป็นผู้ที่ได้วัคซีนไฟเซอร์ 300,000 คน ที่เหลือเป็นวัคซีนแอสตร้าเซนเนก้า"
355,จากกรณีที่มีการเปิดให้ประชาชนที่มีทะเบียนบ้านอยู่ในพื้นที่อำเภอบางละมุง สามารถไปลงทะเบียนหน้างาน หรือ WALK-IN เพื่อขอรับการฉีดวัคซีนไฟเซอร์ เข็มที่ 1 สำหรับกลุ่มเสี่ยงที่ยังไม่เคยได้รับวัคซีนโควิด -19 มาก่อน โดยเปิดให้ลงทะเบียนได้ตั้งแต่ 07.30 น. ของวันที่ 16 สิงหาคม 2564
356,"นายอนุชา บูรพชัยศรี โฆษกประจำสำนักนายกรัฐมนตรี เปิดเผยว่า ที่ประชุมคณะรัฐมนตรี  มีมติเห็นชอบโครงการจัดหาวัคซีนป้องกันโควิด-19 ให้กับคนไทยเพิ่มเติมอีก 20 ล้านโดส ซึ่งเป็นส่วนที่เคยลงนามไปแล้ว โดยวันนี้เป็นการอนุมัติในกรอบวงเงินที่จะนำไปชำระ 9,372 ล้านบาท แบ่งเป็นการจัดหาวัคซีน 8,439 ล้านบาท และค่าบริหารจัดการ 933 ล้านบาท คาดว่าจะส่งมอบในช่วงไตรมาสที่ 4 ประมาณปลายเดือนกันยายนจนถึงต้นเดือนตุลาคมนี้"
357,"นายอนุชา บูรพชัยศรี โฆษกประจำสำนักนายกรัฐมนตรี ชี้แจงว่า สาเหตุที่รัฐบาลสั่งซื้อวัคซีนซิโนแวคเพิ่ม เนื่องจากวัคซีนดังกล่าวมีงานวิจัยและข้อมูลรองรับประสิทธิภาพแล้ว ถึงองค์การอนามัยโลกอนุมัติให้สามารถฉีดวัคซีนไขว้ชนิดกันได้และประเทศไทยได้มีการศึกษาข้อมูล พบว่ากลุ่มที่ฉีดวัคซีนไขว้ ซิโนแวคและแอสตร้าเซนเนก้า กระตุ้นภูมิได้สูงถึง 3,962 มากกว่า กลุ่มที่ฉีดซิโนแวคกับซิโนแวค ถึง 4 เท่า และยังพบว่าสามารถช่วยป้องกันการติดเชื้อสายพันธุ์เดลตาได้ด้วย ดังนั้นระหว่างรอวัคซีนชนิดMRNA ที่จะเข้ามาปลายเดือนกันยายนถึงเดือนตุลาคมนี้ก็จะฉีดวัคซีนไปก่อน"
358,วันนี้ (17 ส.ค.64) ที่ บริเวณโถงด้านหน้าห้องประชุม 1 ชั้น 5 ศาลากลางจังหวัดสงขลา นายวรณัฎฐ์ หนูรอต รองผู้ว่าราชการจังหวัดสงขลา พร้อมด้วย นายจรัญ จันทรปาน ปลัดจังหวัดสงขลา และนายแพทย์ปพน ดีไชยเศรษฐ รองนายแพทย์สาธารณสุขจังหวัดสงขลา ร่วมแถลงข่าวสถานการณ์โควิด-19 รวมทั้งมาตรการต่างๆ ของจังหวัดสงขลา ในการป้องกันการแพร่ระบาดของโรคโควิด-19
359,วันนี้ (17 ส.ค. 64) นายชัยสิทธิ์ พานิชพงศ์ ผู้ว่าราชการจังหวัดยะลา ประธานคณะกรรมการโรคติดต่อจังหวัดยะลา ในฐานะผู้กำกับการบริหารในสถานการณ์ฉุกเฉิน เป็นประธานประชุมคณะกรรมการและคณะทำงานเฝ้าระวังป้องกันและควบคุมการแพร่ระบาดใหม่ของโรคติดเชื้อไวรัสโคโรนา 2019 (โควิด-19) ครั้งที่ 34/2564 พร้อมด้วยรองผู้ว่าราชการจังหวัดยะลา หัวหน้าส่วนราชการ และหน่วยงานที่เกี่ยวข้อง ณ ห้องประชุมศรียะลา อาคาร 3 ชั้น 3 ศาลากลางจังหวัดยะลา
360,"วันนี้ (17 สิงหาคม 2564) เมื่อเวลา 09.00 น. นายภานุ แย้มศรี ผู้ว่าราชการจังหวัดพระนครศรีอยุธยา เป็นประธานการประชุมคณะกรรมการโรคติดต่อจังหวัดพระนครศรีอยุธยา ครั้งที่ 41/2564 ผ่านระบบ Zoom จากห้องประชุมอโยธยา ศาลากลางจังหวัดพระนครศรีอยุธยา ไปยังทุกอำเภอ โดยมี พันเอก(พ) เพิ่มศักดิ์ ขุนโขลน รอง ผอ.รมน.จว. นายประทีป การมิตรี ปลัดจังหวัด นางสมทรง พันธ์เจริญวรกุล นายก อบจ. นพ.พีระ อารีรัตน์ นายแพทย์สาธารณสุขจังหวัด คณะกรรมการฯ และตัวแทนภาคธุรกิจเอกชน เข้าร่วมประชุม พร้อมด้วย หัวหน้าส่วนราชการ ผู้อำนวยการโรงพยาบาล สาธารณสุขอำเภอ และผู้เกี่ยวข้อง เข้าร่วมประชุมผ่านระบบ Zoom เพื่อติดตามและกำหนดมาตรการบริหารสถานการณ์โรคติดเชื้อไวรัสโคโรนา 2019 (COVID-19) ภายในจังหวัดพระนครศรีอยุธยา ภายใต้มาตรการป้องกันโรคโควิด-19 อย่างเคร่งครัด โดยสถานการณ์ผู้ติดเชื้อโควิด-19 ในจังหวัดพระนครศรีอยุธยา มียอดสะสมระลอกเมษายน 15,582 ราย พบผู้ติดเชื้อรายใหม่ 433 ราย รักษาหายแล้ว 7,751 ราย และเสียชีวิตสะสม 134 ราย"
361,สำนักข่าวต่างประเทศรายงานว่า บริษัทไฟเซอร์ และไบโอเอ็นเทค ยื่นข้อมูลการทดสอบทางคลินิกระยะที่ 1ของการฉีดวัคซีนโควิด-19 เข็มที่ 3 หรือเข็มกระตุ้น ต่อสำนักงานคณะกรรมการอาหารและยา ของสหรัฐฯ แล้วซึ่งเป็นส่วนหนึ่งของขั้นตอนการขออนุมัติการฉีดวัคซีนเข็มที่ 3 ให้ชาวอเมริกัน           ด้านเจ้าหน้าที่ระดับสูงของบริษัทไฟเซอร์ ระบุว่า การฉีดวัคซีนเข็มกระตุ้นจะช่วยลดอัตราการติดเชื้อและอาการป่วยรุนแรงในผู้ที่ฉีดวัคซีนแล้ว รวมถึงช่วยควบคุมการระบาดของเชื้อโควิด-19 ชนิดกลายพันธุ์ ในช่วงฤดูหนาวที่กำลังจะมาถึง           ทั้งนี้ ทางการสหรัฐฯอนุมัติการฉีดวัคซีนโควิด-19 ขอไฟเซอร์-ไบโอเอ็นเทคและโมเดอร์นา เป็นวัคซีนเข็มกระตุ้น ให้ผู้ที่ภูมิคุ้มกันร่างกายอ่อนแอ ขณะที่ศูนย์ควบคุมและป้องกันโรคของสหรัฐฯ เตรียมพิจารณาอนุมัติการฉีดวัคซีนเข็มที่ 3ให้ผู้ที่มีอายุ 65 ปี ขึ้นไปและบุคลากรทางการแพทย์ ในช่วงปลายเดือนนี้.
